{
	"schemaVersion": 1,
	"entityType": "breed",
	"id": "peterbald",
	"species": [
		"feline"
	],
	"originPlaceIds": [
		"ru"
	],
	"sizeTermKey": "medium",
	"averageWeightKg": {
		"male": [
			3.5,
			5.5
		],
		"female": [
			2.5,
			4.5
		]
	},
	"averageHeightCm": {
		"male": [
			22,
			27
		],
		"female": [
			20,
			25
		]
	},
	"localizedContent": {
		"name": {
			"pt-BR": "Peterbald",
			"pt-PT": "Peterbald",
			"gn-PY": "Peterbald",
			"en-US": "Peterbald",
			"es-ES": "Peterbald",
			"fr-FR": "Peterbald"
		},
		"aliases": {
			"pt-BR": [],
			"pt-PT": [],
			"gn-PY": [],
			"en-US": [],
			"es-ES": [],
			"fr-FR": []
		}
	},
	"sections": []
}
