{
	"schemaVersion": 1,
	"entityType": "breed",
	"id": "treeing-walker-coonhound",
	"species": [
		"canine"
	],
	"originPlaceIds": [
		"us"
	],
	"sizeTermKey": "large",
	"averageWeightKg": {
		"male": [
			25,
			32
		],
		"female": [
			23,
			29
		]
	},
	"averageHeightCm": {
		"male": [
			56,
			69
		],
		"female": [
			51,
			64
		]
	},
	"localizedContent": {
		"name": {
			"pt-BR": "Treeing Walker Coonhound",
			"pt-PT": "Treeing Walker Coonhound",
			"gn-PY": "Treeing Walker Coonhound",
			"en-US": "Treeing Walker Coonhound",
			"es-ES": "Treeing Walker Coonhound",
			"fr-FR": "Treeing Walker Coonhound"
		},
		"aliases": {
			"pt-BR": [],
			"pt-PT": [],
			"gn-PY": [],
			"en-US": [],
			"es-ES": [],
			"fr-FR": []
		}
	},
	"sections": []
}
