{
	"schemaVersion": 1,
	"entityType": "breed",
	"id": "curly-coated-retriever",
	"species": [
		"canine"
	],
	"originPlaceIds": [
		"england"
	],
	"sizeTermKey": "large",
	"averageWeightKg": {
		"male": [
			32,
			43
		],
		"female": [
			27,
			36
		]
	},
	"averageHeightCm": {
		"male": [
			64,
			69
		],
		"female": [
			58,
			64
		]
	},
	"localizedContent": {
		"name": {
			"pt-BR": "Curly-Coated Retriever",
			"pt-PT": "Curly-Coated Retriever",
			"gn-PY": "Curly-Coated Retriever",
			"en-US": "Curly-Coated Retriever",
			"es-ES": "Curly-Coated Retriever",
			"fr-FR": "Curly-Coated Retriever"
		},
		"aliases": {
			"pt-BR": [],
			"pt-PT": [],
			"gn-PY": [],
			"en-US": [],
			"es-ES": [],
			"fr-FR": []
		}
	},
	"sections": []
}
