{
	"schemaVersion": 1,
	"entityType": "breed",
	"id": "borzoi",
	"species": [
		"canine"
	],
	"originPlaceIds": [
		"ru"
	],
	"sizeTermKey": "giant",
	"averageWeightKg": {
		"male": [
			34,
			48
		],
		"female": [
			27,
			41
		]
	},
	"averageHeightCm": {
		"male": [
			75,
			85
		],
		"female": [
			66,
			78
		]
	},
	"localizedContent": {
		"name": {
			"pt-BR": "Borzoi",
			"pt-PT": "Borzoi",
			"gn-PY": "Borzoi",
			"en-US": "Borzoi",
			"es-ES": "Borzoi",
			"fr-FR": "Barzoï"
		},
		"aliases": {
			"pt-BR": [],
			"pt-PT": [],
			"gn-PY": [],
			"en-US": [],
			"es-ES": [],
			"fr-FR": []
		}
	},
	"sections": []
}
