{
	"schemaVersion": 1,
	"entityType": "breed",
	"id": "oriental-shorthair",
	"species": [
		"feline"
	],
	"originPlaceIds": [
		"england"
	],
	"sizeTermKey": "medium",
	"averageWeightKg": {
		"male": [
			3.5,
			5.5
		],
		"female": [
			2.5,
			4.5
		]
	},
	"averageHeightCm": {
		"male": [
			22,
			26
		],
		"female": [
			20,
			24
		]
	},
	"localizedContent": {
		"name": {
			"pt-BR": "Oriental Shorthair",
			"pt-PT": "Oriental Shorthair",
			"gn-PY": "Oriental de pelo corto",
			"en-US": "Oriental Shorthair",
			"es-ES": "Oriental de pelo corto",
			"fr-FR": "Oriental à poil court"
		},
		"aliases": {
			"pt-BR": [],
			"pt-PT": [],
			"gn-PY": [],
			"en-US": [],
			"es-ES": [],
			"fr-FR": []
		}
	},
	"sections": []
}
