{
	"schemaVersion": 1,
	"entityType": "breed",
	"id": "australian-cattle-dog",
	"species": [
		"canine"
	],
	"originPlaceIds": [
		"au"
	],
	"sizeTermKey": "medium",
	"averageWeightKg": {
		"male": [
			16,
			22
		],
		"female": [
			14,
			20
		]
	},
	"averageHeightCm": {
		"male": [
			46,
			51
		],
		"female": [
			43,
			48
		]
	},
	"localizedContent": {
		"name": {
			"pt-BR": "Boiadeiro Australiano (Blue Heeler)",
			"pt-PT": "Boiadeiro australiano",
			"gn-PY": "Boyero australiano",
			"en-US": "Australian Cattle Dog",
			"es-ES": "Boyero australiano",
			"fr-FR": "Bouvier australien"
		},
		"aliases": {
			"pt-BR": [],
			"pt-PT": [],
			"gn-PY": [],
			"en-US": [],
			"es-ES": [],
			"fr-FR": []
		}
	},
	"sections": []
}
