{
	"schemaVersion": 1,
	"entityType": "breed",
	"id": "estrela-mountain-dog",
	"species": [
		"canine"
	],
	"originPlaceIds": [
		"pt"
	],
	"sizeTermKey": "giant",
	"averageWeightKg": {
		"male": [
			45,
			60
		],
		"female": [
			35,
			45
		]
	},
	"averageHeightCm": {
		"male": [
			65,
			72
		],
		"female": [
			62,
			68
		]
	},
	"localizedContent": {
		"name": {
			"pt-BR": "Cão da Serra da Estrela",
			"pt-PT": "Cão da Serra da Estrela",
			"gn-PY": "Perro de la Sierra de la Estrella",
			"en-US": "Estrela Mountain Dog",
			"es-ES": "Perro de la Sierra de la Estrella",
			"fr-FR": "Chien de montagne de l'Estrela"
		},
		"aliases": {
			"pt-BR": [],
			"pt-PT": [],
			"gn-PY": [],
			"en-US": [],
			"es-ES": [],
			"fr-FR": []
		}
	},
	"sections": []
}
