{
	"schemaVersion": 1,
	"entityType": "breed",
	"id": "russian-toy",
	"species": [
		"canine"
	],
	"originPlaceIds": [
		"ru"
	],
	"sizeTermKey": "small",
	"averageWeightKg": {
		"male": [
			1.5,
			3
		],
		"female": [
			1.3,
			2.8
		]
	},
	"averageHeightCm": {
		"male": [
			22,
			27
		],
		"female": [
			20,
			26
		]
	},
	"localizedContent": {
		"name": {
			"pt-BR": "Toy Russo",
			"pt-PT": "Toy Russo",
			"gn-PY": "Toy ruso",
			"en-US": "Russian Toy",
			"es-ES": "Toy ruso",
			"fr-FR": "Petit chien russe"
		},
		"aliases": {
			"pt-BR": [],
			"pt-PT": [],
			"gn-PY": [],
			"en-US": [],
			"es-ES": [],
			"fr-FR": []
		}
	},
	"sections": []
}
