{
	"schemaVersion": 1,
	"entityType": "breed",
	"id": "american-bully",
	"species": [
		"canine"
	],
	"originPlaceIds": [
		"us"
	],
	"sizeTermKey": "large",
	"averageWeightKg": {
		"male": [
			30,
			50
		],
		"female": [
			25,
			45
		]
	},
	"averageHeightCm": {
		"male": [
			43,
			51
		],
		"female": [
			40,
			48
		]
	},
	"localizedContent": {
		"name": {
			"pt-BR": "American Bully",
			"pt-PT": "American Bully",
			"gn-PY": "American Bully",
			"en-US": "American Bully",
			"es-ES": "American Bully",
			"fr-FR": "American Bully"
		},
		"aliases": {
			"pt-BR": [],
			"pt-PT": [],
			"gn-PY": [],
			"en-US": [],
			"es-ES": [],
			"fr-FR": []
		}
	},
	"sections": []
}
