{
	"schemaVersion": 1,
	"entityType": "breed",
	"id": "saluki",
	"species": [
		"canine"
	],
	"originPlaceIds": [
		"middle-east"
	],
	"sizeTermKey": "large",
	"averageWeightKg": {
		"male": [
			20,
			27
		],
		"female": [
			18,
			23
		]
	},
	"averageHeightCm": {
		"male": [
			58,
			71
		],
		"female": [
			56,
			66
		]
	},
	"localizedContent": {
		"name": {
			"pt-BR": "Saluki",
			"pt-PT": "Saluki",
			"gn-PY": "Saluki",
			"en-US": "Saluki",
			"es-ES": "Saluki",
			"fr-FR": "Sloughi (Saluki)"
		},
		"aliases": {
			"pt-BR": [],
			"pt-PT": [],
			"gn-PY": [],
			"en-US": [],
			"es-ES": [],
			"fr-FR": []
		}
	},
	"sections": []
}
