{
	"schemaVersion": 1,
	"entityType": "breed",
	"id": "bedlington-terrier",
	"species": [
		"canine"
	],
	"originPlaceIds": [
		"england"
	],
	"sizeTermKey": "medium",
	"averageWeightKg": {
		"male": [
			8,
			10
		],
		"female": [
			7,
			9
		]
	},
	"averageHeightCm": {
		"male": [
			41,
			44
		],
		"female": [
			38,
			42
		]
	},
	"localizedContent": {
		"name": {
			"pt-BR": "Bedlington Terrier",
			"pt-PT": "Bedlington Terrier",
			"gn-PY": "Bedlington Terrier",
			"en-US": "Bedlington Terrier",
			"es-ES": "Bedlington Terrier",
			"fr-FR": "Bedlington Terrier"
		},
		"aliases": {
			"pt-BR": [],
			"pt-PT": [],
			"gn-PY": [],
			"en-US": [],
			"es-ES": [],
			"fr-FR": []
		}
	},
	"sections": []
}
