{
	"schemaVersion": 1,
	"entityType": "breed",
	"id": "boston-terrier",
	"species": [
		"canine"
	],
	"originPlaceIds": [
		"us"
	],
	"sizeTermKey": "small",
	"averageWeightKg": {
		"male": [
			6,
			11
		],
		"female": [
			5,
			10
		]
	},
	"averageHeightCm": {
		"male": [
			38,
			43
		],
		"female": [
			36,
			41
		]
	},
	"localizedContent": {
		"name": {
			"pt-BR": "Boston Terrier",
			"pt-PT": "Boston Terrier",
			"gn-PY": "Boston Terrier",
			"en-US": "Boston Terrier",
			"es-ES": "Boston Terrier",
			"fr-FR": "Boston Terrier"
		},
		"aliases": {
			"pt-BR": [],
			"pt-PT": [],
			"gn-PY": [],
			"en-US": [],
			"es-ES": [],
			"fr-FR": []
		}
	},
	"sections": []
}
