{
	"schemaVersion": 1,
	"entityType": "breed",
	"id": "teddy-roosevelt-terrier",
	"species": [
		"canine"
	],
	"originPlaceIds": [
		"us"
	],
	"sizeTermKey": "small",
	"averageWeightKg": {
		"male": [
			4,
			11
		],
		"female": [
			3.5,
			10
		]
	},
	"averageHeightCm": {
		"male": [
			20,
			36
		],
		"female": [
			20,
			36
		]
	},
	"localizedContent": {
		"name": {
			"pt-BR": "Teddy Roosevelt Terrier",
			"pt-PT": "Teddy Roosevelt Terrier",
			"gn-PY": "Teddy Roosevelt Terrier",
			"en-US": "Teddy Roosevelt Terrier",
			"es-ES": "Teddy Roosevelt Terrier",
			"fr-FR": "Teddy Roosevelt Terrier"
		},
		"aliases": {
			"pt-BR": [],
			"pt-PT": [],
			"gn-PY": [],
			"en-US": [],
			"es-ES": [],
			"fr-FR": []
		}
	},
	"sections": []
}
