{
	"schemaVersion": 1,
	"entityType": "breed",
	"id": "russian-spaniel",
	"species": [
		"canine"
	],
	"originPlaceIds": [
		"ru"
	],
	"sizeTermKey": "medium",
	"averageWeightKg": {
		"male": [
			13,
			18
		],
		"female": [
			12,
			16
		]
	},
	"averageHeightCm": {
		"male": [
			38,
			44
		],
		"female": [
			36,
			42
		]
	},
	"localizedContent": {
		"name": {
			"pt-BR": "Spaniel Russo",
			"pt-PT": "Spaniel Russo",
			"gn-PY": "Spaniel ruso",
			"en-US": "Russian Spaniel",
			"es-ES": "Spaniel ruso",
			"fr-FR": "Épagneul russe"
		},
		"aliases": {
			"pt-BR": [],
			"pt-PT": [],
			"gn-PY": [],
			"en-US": [],
			"es-ES": [],
			"fr-FR": []
		}
	},
	"sections": []
}
